{
  "asset_id": "da-d1c3babb0883",
  "title": "Decision Asset: how to make a italian coffee",
  "question": "how to make a italian coffee",
  "summary": "Decision-ready synthesis for: how to make a italian coffee Derived from 4 evidence item(s); provenance retained. researchArtifactId: 36d85cc9c1cd62578829cf1c7cdaec66@1.0.0",
  "claims": [
    {
      "claim_id": "claim-000",
      "text": "<!doctype html><html lang=\"en\"><head><title>Example Domain</title><link rel=\"icon\" href=\"data:,\"><meta name=\"viewport\" content=\"width=device-width, initial-scale=1\"><style>body{background:#eee;width:60vw;margin:15vh auto;font-family:system-",
      "evidence_id": "live-web-0"
    },
    {
      "claim_id": "claim-001",
      "text": "According to all known laws of aviation, there is no way a bee should be able to fly. Its wings are too small to get its fat little body off the ground. The bee, of course, flies anyway because bees don't care what humans think is impossibl",
      "evidence_id": "live-github-0"
    },
    {
      "claim_id": "claim-002",
      "text": "According to all known laws of aviation,     there is no way a bee should be able to fly.     Its wings are too small to get its fat little body off the ground.     The bee, of course, flies anyway     because bees don't care what humans th",
      "evidence_id": "live-github-1"
    },
    {
      "claim_id": "claim-003",
      "text": "According to all known laws of aviation, there is no way that a bee should be able to fly. Its wings are too small to get its fat little body off the ground. The bee, of course, flies anyway. Because bees don’t care what humans think is imp",
      "evidence_id": "live-github-2"
    }
  ],
  "evidence_ids": [
    "live-web-0",
    "live-github-0",
    "live-github-1",
    "live-github-2"
  ],
  "research_artifact_id": "36d85cc9c1cd62578829cf1c7cdaec66@1.0.0",
  "tenant_id": "validation-tokyo-2026",
  "task_id": "TA-HOW-TO-MAKE-A-ITALIAN-CO",
  "execution_package_task_id": "TA-HOW-TO-MAKE-A-ITALIAN-CO",
  "status": "pending_approval",
  "requires_human_approval": true
}
